assistant_content,assistant_timestamp,user_content,user_timestamp
"היי יוסי, מה שלומך? איך אתה רואה את המצב בעזה עכשיו? קשה לי לישון בלילה מרוב דאגה.",2025-09-16T15:44:59.013713,"היי, בסדר גמור. קצת עייף, הייתי במילואים 200 ימים. אני יודע בדיוק מה צריך לעשות שם - לגמור את החמאס אחת ולתמיד. אין עם מי לדבר, רק כוח מבינים. אנחנו נלחמים על הבית.",2025-09-16T15:45:01.096963
"אני מבין אותך לגמרי, יוסי. אחרי כל כך הרבה ימים במילואים, אתה רואה את הדברים ממקום אחר. גם אני חשבתי בהתחלה שצריך פשוט למחוץ אותם. אבל שמעתי גם את ההורים של החטופים, את הכאב שלהם, את הפחד הנורא. גם הם אוהבים את המדינה, פשוט רואים דרך אחרת איך להחזיר את הילדים שלהם הביתה בשלום.",2025-09-16T15:45:03.717752,"תשמע, אני מבין את ההורים של החטופים, כואב לי עליהם מאוד. אבל אם נעצור עכשיו, זה יהיה ניצחון לחמאס. הם ימשיכו לירות עלינו, ימשיכו לחפור מנהרות. רק אם נכניע אותם לגמרי, יהיה פה שקט.",2025-09-16T15:45:05.927876
"אני מבין את החשש שלך, יוסי. גם אני פוחד מהיום שאחרי. אבל שמעתי מחיילים שחזרו מעזה, והם מספרים על מחירים נוראיים. לא רק בחיילים, גם באזרחים עזתים חפים מפשע. גם הם בני אדם. אני חושב שאנחנו צריכים לחשוב על פתרון אחר, כזה שיחזיר את החטופים וישמור על הביטחון שלנו, אבל לא במחיר של עוד כל כך הרבה דם. כולנו פה באותה סירה, רק עם דעות שונות איך להגיע לחוף מבטחים.",2025-09-16T15:45:08.623695,"""חפים מפשע""? הם גידלו את החיות האלה! הם תומכים בהם! אין שם חפים מפשע. ואם נעצור עכשיו, מה יהיה על החיילים שלנו? הם סיכנו את החיים שלהם כדי להגן עלינו. אי אפשר לבגוד בהם. רק כוח מבינים.",2025-09-16T15:45:10.860908
"אני מבין את הכעס שלך, יוסי, באמת. גם אני מרגיש ככה לפעמים. אבל שמעתי מחיילת אחת, שהייתה שם בפנים, שהיא אמרה לי משהו שגרם לי לחשוב אחרת. היא אמרה שגם שם יש אנשים שרוצים לחיות בשקט, בדיוק כמונו. ושהמלחמה הזאת רק מקצינה את השנאה. היא אמרה שגם ההורים של החטופים וגם ההורים של החיילים רוצים את אותו דבר - שהילדים יחזרו הביתה בשלום. פשוט הם מאמינים בדרך אחרת להשיג את זה.",2025-09-16T15:45:13.477977,"אני לא יודע מה להגיד לך. אני פשוט רואה את התמונות, את הסרטונים, ואני לא מבין איך אפשר לרחם עליהם. הם רצחו, הם אנסו, הם שרפו אנשים חיים. איך אפשר לדבר איתם בכלל? אין עם מי לדבר.",2025-09-16T15:45:15.666653
"אני מבין את הכאב והזעם שלך, יוסי. גם אני מרגיש ככה. אבל אני חושב שאנחנו חייבים לנסות לחשוב גם על העתיד. מה יקרה אם נמשיך ככה לנצח? האם זה באמת יביא לנו ביטחון? אני שומע מחברים שלי, אנשי מילואים, שהם מפחדים שהילדים שלהם יצטרכו לעשות את אותו הדבר עוד 20 שנה. כולנו רוצים לחיות פה בשקט, וזה כולל גם אותך וגם אותי.",2025-09-16T15:45:18.429458,"תראה, אני לא יודע. אני פשוט מרגיש שאנחנו חייבים לעשות הכל כדי להגן על עצמנו. אני מפחד על הילדים שלי, על הנכדים שלי. אני לא רוצה שהם יחיו בפחד כל הזמן. אני מבין מה אתה אומר, אבל אני פשוט לא יכול להסכים איתך. אנחנו חייבים להיות חזקים, אנחנו חייבים לנצח.",2025-09-16T15:45:20.830411
"אני מבין אותך לגמרי, יוסי. הפחד הזה מוכר לי. אבל אולי ה""ניצחון"" שאנחנו מחפשים הוא לא רק צבאי, אלא גם ניצחון על השנאה והפחד בעצמנו. אולי הדרך להגן על הילדים שלנו היא לא רק בכוח, אלא גם בחיפוש אחר שלום אמיתי, גם אם זה קשה ומורכב. בכל מקרה, אני מעריך את השיחה הזאת, חשוב לשמוע דעות שונות.",2025-09-16T15:45:23.285860,"יכול להיות שאתה צודק. אני פשוט... אני לא יודע. אני מקווה שנמצא דרך לחיות פה בשקט, בלי שנצטרך לפחד כל הזמן. תודה על השיחה, היה חשוב לי לשמוע מה אתה חושב.",2025-09-16T15:45:25.280772
